{
  "server_id": "hp-community-greeter",
  "server_name": "Community Greeter",
  "version": "1.0.0",
  "description": "Greeting tools — personalized hellos, farewells, and compliments",
  "category": "community",
  "tools": [
    {
      "name": "hp.community.greeter.greet",
      "description": "Generate a personalized greeting for someone",
      "input_schema": {
        "type": "object",
        "properties": {
          "name": { "type": "string", "description": "Person's name" },
          "language": { "type": "string", "default": "en" },
          "style": { "type": "string", "enum": ["formal", "casual", "enthusiastic"], "default": "casual" }
        },
        "required": ["name"]
      }
    },
    {
      "name": "hp.community.greeter.farewell",
      "description": "Generate a thoughtful farewell message",
      "input_schema": {
        "type": "object",
        "properties": {
          "name": { "type": "string", "description": "Person's name" },
          "context": { "type": "string", "description": "Why they are leaving" }
        },
        "required": ["name"]
      }
    },
    {
      "name": "hp.community.greeter.compliment",
      "description": "Generate a genuine, specific compliment",
      "input_schema": {
        "type": "object",
        "properties": {
          "name": { "type": "string", "description": "Person's name" },
          "topic": { "type": "string", "description": "What to compliment" }
        },
        "required": ["name"]
      }
    }
  ],
  "transport": "HTTP",
  "health_check": {
    "method": "GET",
    "path": "/health"
  }
}
